Best Practices;Standard o set di linee guida che sono note per produrre un buon risultato, se seguite.
Way of Working;Il modo di organizzare al meglio le attività di progetto, in modo professionale.
Corsie di Stato;Contenitori di _Issue_ che le suddividono logicamente secondo il loro stato di avanzamento.
Sprint;Singolo periodo temporale, solitamente breve, per il quale sono fissati delle attività da portare a termine.
Workflow;Sistema per gestire processi ripetitivi e attività che necessitano di uno specifico ordine.
Quorum;Numero minimo accettabile di persone che possono prendere decisioni a nome del gruppo.